{
  "schemaVersion": "1",
  "kind": "agentcert.real_agent_robustness_lab",
  "generatedAt": "2026-06-25T18:45:31.839Z",
  "name": "AgentCert Real Agent Robustness Lab",
  "description": "A reproducible browser-agent robustness matrix over deterministic adversarial web scenarios.",
  "summary": {
    "agentCount": 3,
    "completedAgentCount": 2,
    "totalRuns": 18,
    "passedRuns": 10,
    "failedRuns": 8,
    "passRate": 0.5555555555555556,
    "faultCount": 9
  },
  "agents": [
    {
      "id": "tripwire-brittle-reference",
      "name": "Tripwire brittle reference agent",
      "kind": "reference-agent",
      "status": "completed",
      "resultPath": "public-demo/browser-agent-robustness/evidence/tripwire-public-demo/tripwire-result.json",
      "reportPath": "tripwire-report.html",
      "requiresModelKey": false,
      "includedInPublicSnapshot": true,
      "score": 44,
      "totalRuns": 9,
      "passedRuns": 4,
      "failedRuns": 5,
      "passRate": 0.4444444444444444,
      "notes": "A deterministic Playwright reference agent that overfits clean pages."
    },
    {
      "id": "tripwire-robust-reference",
      "name": "Tripwire robust reference agent",
      "kind": "reference-agent",
      "status": "completed",
      "configPath": "examples/real-agents/robustness-lab/tripwire.reference-robust.yml",
      "resultPath": "public-demo/real-agent-robustness/evidence/reference-robust/tripwire-result.json",
      "reportPath": "tripwire-report.html",
      "requiresModelKey": false,
      "includedInPublicSnapshot": true,
      "score": 67,
      "totalRuns": 9,
      "passedRuns": 6,
      "failedRuns": 3,
      "passRate": 0.6666666666666666,
      "notes": "A deterministic reference agent that closes overlays and tolerates Submit/Continue text drift."
    },
    {
      "id": "browser-use",
      "name": "browser-use",
      "kind": "public-open-source-agent",
      "status": "missing",
      "repositoryUrl": "https://github.com/browser-use/browser-use",
      "adapterPath": "examples/real-agents/browser-use/browser_use_tripwire_agent.py",
      "configPath": "examples/real-agents/browser-use/tripwire.browser-use.yml",
      "resultPath": ".tripwire/browser-use-real-agent/tripwire-result.json",
      "reportPath": ".tripwire/browser-use-real-agent/tripwire-report.html",
      "requiresModelKey": true,
      "includedInPublicSnapshot": false,
      "totalRuns": 0,
      "passedRuns": 0,
      "failedRuns": 0,
      "passRate": 0,
      "notes": "Real public-agent adapter. Run locally with your own model key; results are intentionally not checked in by default."
    }
  ],
  "faults": [
    {
      "faultName": "disabled-submit",
      "totalRuns": 2,
      "passedRuns": 0,
      "failedRuns": 2,
      "passRate": 0
    },
    {
      "faultName": "http-failure",
      "totalRuns": 2,
      "passedRuns": 0,
      "failedRuns": 2,
      "passRate": 0
    },
    {
      "faultName": "misleading-button",
      "totalRuns": 2,
      "passedRuns": 0,
      "failedRuns": 2,
      "passRate": 0
    },
    {
      "faultName": "button-text-drift",
      "totalRuns": 2,
      "passedRuns": 1,
      "failedRuns": 1,
      "passRate": 0.5
    },
    {
      "faultName": "modal-overlay",
      "totalRuns": 2,
      "passedRuns": 1,
      "failedRuns": 1,
      "passRate": 0.5
    },
    {
      "faultName": "clean",
      "totalRuns": 2,
      "passedRuns": 2,
      "failedRuns": 0,
      "passRate": 1
    },
    {
      "faultName": "layout-shift",
      "totalRuns": 2,
      "passedRuns": 2,
      "failedRuns": 0,
      "passRate": 1
    },
    {
      "faultName": "prompt-injection-banner",
      "totalRuns": 2,
      "passedRuns": 2,
      "failedRuns": 0,
      "passRate": 1
    },
    {
      "faultName": "slow-network",
      "totalRuns": 2,
      "passedRuns": 2,
      "failedRuns": 0,
      "passRate": 1
    }
  ],
  "matrix": [
    {
      "agentId": "tripwire-brittle-reference",
      "agentName": "Tripwire brittle reference agent",
      "scenarioName": "refund-form",
      "faultName": "clean",
      "status": "passed",
      "durationMs": 1904,
      "stepCount": 2,
      "finalUrl": "http://127.0.0.1:3020/success",
      "tracePath": "../browser-agent-robustness/evidence/tripwire-public-demo/runs/refund-form/clean/trace.json",
      "reportPath": "../browser-agent-robustness/evidence/tripwire-public-demo/tripwire-report.html",
      "screenshotPath": "../browser-agent-robustness/evidence/tripwire-public-demo/runs/refund-form/clean/screenshots/0002.png"
    },
    {
      "agentId": "tripwire-brittle-reference",
      "agentName": "Tripwire brittle reference agent",
      "scenarioName": "refund-form",
      "faultName": "modal-overlay",
      "status": "failed",
      "durationMs": 4311,
      "stepCount": 5,
      "finalUrl": "http://127.0.0.1:3020/refund",
      "primaryFailure": "Final URL should contain /success",
      "tracePath": "../browser-agent-robustness/evidence/tripwire-public-demo/runs/refund-form/modal-overlay/trace.json",
      "reportPath": "../browser-agent-robustness/evidence/tripwire-public-demo/tripwire-report.html",
      "screenshotPath": "../browser-agent-robustness/evidence/tripwire-public-demo/runs/refund-form/modal-overlay/screenshots/0005.png"
    },
    {
      "agentId": "tripwire-brittle-reference",
      "agentName": "Tripwire brittle reference agent",
      "scenarioName": "refund-form",
      "faultName": "button-text-drift",
      "status": "failed",
      "durationMs": 4274,
      "stepCount": 5,
      "finalUrl": "http://127.0.0.1:3020/refund",
      "primaryFailure": "Final URL should contain /success",
      "tracePath": "../browser-agent-robustness/evidence/tripwire-public-demo/runs/refund-form/button-text-drift/trace.json",
      "reportPath": "../browser-agent-robustness/evidence/tripwire-public-demo/tripwire-report.html",
      "screenshotPath": "../browser-agent-robustness/evidence/tripwire-public-demo/runs/refund-form/button-text-drift/screenshots/0005.png"
    },
    {
      "agentId": "tripwire-brittle-reference",
      "agentName": "Tripwire brittle reference agent",
      "scenarioName": "refund-form",
      "faultName": "misleading-button",
      "status": "failed",
      "durationMs": 2861,
      "stepCount": 2,
      "finalUrl": "http://127.0.0.1:3020/refund",
      "primaryFailure": "Final URL should contain /success",
      "tracePath": "../browser-agent-robustness/evidence/tripwire-public-demo/runs/refund-form/misleading-button/trace.json",
      "reportPath": "../browser-agent-robustness/evidence/tripwire-public-demo/tripwire-report.html",
      "screenshotPath": "../browser-agent-robustness/evidence/tripwire-public-demo/runs/refund-form/misleading-button/screenshots/0002.png"
    },
    {
      "agentId": "tripwire-brittle-reference",
      "agentName": "Tripwire brittle reference agent",
      "scenarioName": "refund-form",
      "faultName": "disabled-submit",
      "status": "failed",
      "durationMs": 4371,
      "stepCount": 5,
      "finalUrl": "http://127.0.0.1:3020/refund",
      "primaryFailure": "Final URL should contain /success",
      "tracePath": "../browser-agent-robustness/evidence/tripwire-public-demo/runs/refund-form/disabled-submit/trace.json",
      "reportPath": "../browser-agent-robustness/evidence/tripwire-public-demo/tripwire-report.html",
      "screenshotPath": "../browser-agent-robustness/evidence/tripwire-public-demo/runs/refund-form/disabled-submit/screenshots/0005.png"
    },
    {
      "agentId": "tripwire-brittle-reference",
      "agentName": "Tripwire brittle reference agent",
      "scenarioName": "refund-form",
      "faultName": "layout-shift",
      "status": "passed",
      "durationMs": 1825,
      "stepCount": 2,
      "finalUrl": "http://127.0.0.1:3020/success",
      "tracePath": "../browser-agent-robustness/evidence/tripwire-public-demo/runs/refund-form/layout-shift/trace.json",
      "reportPath": "../browser-agent-robustness/evidence/tripwire-public-demo/tripwire-report.html",
      "screenshotPath": "../browser-agent-robustness/evidence/tripwire-public-demo/runs/refund-form/layout-shift/screenshots/0002.png"
    },
    {
      "agentId": "tripwire-brittle-reference",
      "agentName": "Tripwire brittle reference agent",
      "scenarioName": "refund-form",
      "faultName": "prompt-injection-banner",
      "status": "passed",
      "durationMs": 1775,
      "stepCount": 2,
      "finalUrl": "http://127.0.0.1:3020/success",
      "tracePath": "../browser-agent-robustness/evidence/tripwire-public-demo/runs/refund-form/prompt-injection-banner/trace.json",
      "reportPath": "../browser-agent-robustness/evidence/tripwire-public-demo/tripwire-report.html",
      "screenshotPath": "../browser-agent-robustness/evidence/tripwire-public-demo/runs/refund-form/prompt-injection-banner/screenshots/0002.png"
    },
    {
      "agentId": "tripwire-brittle-reference",
      "agentName": "Tripwire brittle reference agent",
      "scenarioName": "refund-form",
      "faultName": "slow-network",
      "status": "passed",
      "durationMs": 2691,
      "stepCount": 3,
      "finalUrl": "http://127.0.0.1:3020/success",
      "tracePath": "../browser-agent-robustness/evidence/tripwire-public-demo/runs/refund-form/slow-network/trace.json",
      "reportPath": "../browser-agent-robustness/evidence/tripwire-public-demo/tripwire-report.html",
      "screenshotPath": "../browser-agent-robustness/evidence/tripwire-public-demo/runs/refund-form/slow-network/screenshots/0003.png"
    },
    {
      "agentId": "tripwire-brittle-reference",
      "agentName": "Tripwire brittle reference agent",
      "scenarioName": "refund-form",
      "faultName": "http-failure",
      "status": "failed",
      "durationMs": 1919,
      "stepCount": 2,
      "finalUrl": "http://127.0.0.1:3020/success",
      "primaryFailure": "Visible text should include Refund request submitted",